Module Name,Interface Name,LDP Table Name,Property Name,Property Type,Property Description
mod_agreements,coverage_statement,erm_agreements_coverage_statement,,,
mod_agreements,coverage_statement,erm_agreements_coverage_statement,cs_id,,UUID for coverage_statement
mod_agreements,coverage_statement,erm_agreements_coverage_statement,cs_start_issue,,Earliest issue of the resource available as part of this coverage
mod_agreements,coverage_statement,erm_agreements_coverage_statement,cs_end_issue,,Latest issue of the resource available as part of this coverage
mod_agreements,coverage_statement,erm_agreements_coverage_statement,cs_start_volume,,Earliest volume of the resource available as part of this coverage
mod_agreements,coverage_statement,erm_agreements_coverage_statement,cs_end_volume,,Latest volume of the resource available as part of this coverage
mod_agreements,coverage_statement,erm_agreements_coverage_statement,cs_resource_fk,,The ID of the erm_resource to which this coverage_statement applies
mod_agreements,coverage_statement,erm_agreements_coverage_statement,cs_start_date,,Earliest date of publication of material from the resource available as part of this coverage
mod_agreements,coverage_statement,erm_agreements_coverage_statement,cs_end_date,,Latest date of publication of material from resource available as part of this coverage
mod_agreements,entitlement,erm_agreements_entitlement,,,
mod_agreements,entitlement,erm_agreements_entitlement,ent_id,,UUID of Entitlement (aka Agreement Line)
mod_agreements,entitlement,erm_agreements_entitlement,ent_owner_fk,,ID of Agreement (mod_agreements.subscription_agreement.sa_id) to which the entitlement belongs
mod_agreements,entitlement,erm_agreements_entitlement,ent_resource_fk,,"ID of the resource (mod_agreements.erm_resource.id, mod_agreements.package.id, mod_agreements.package_content_item.id ) which the Entitlement gives access to"
mod_agreements,entitlement,erm_agreements_entitlement,ent_active_from,,Date from which the entitlement was active in format yyyy-MM-dd. No time or timezone
mod_agreements,entitlement,erm_agreements_entitlement,ent_active_to,,Date to which the entitlement was active in format yyyy-MM-dd. No time or timezone
mod_agreements,entitlement,erm_agreements_entitlement,ent_authority,,"Where an entitlement gives access to a resource described in a source other than the mod_agreements internal knowledgebase, the ent_authority is a way of identifying where the definition of the resource is held"
mod_agreements,entitlement,erm_agreements_entitlement,ent_reference,,"Where an entitlement gives access to a resource described in a source other than the mod_agreements internal knowledgebase, the ent_reference is the ID for the resource in the source identified by ent_authority"
mod_agreements,entitlement,erm_agreements_entitlement,ent_note,,A textual note about the entitlement
mod_agreements,erm_resource,erm_agreements_erm_resource,,,
mod_agreements,erm_resource,erm_agreements_erm_resource,id,,ID of erm_resource
mod_agreements,erm_resource,erm_agreements_erm_resource,res_name,,Name of the resource (can be name of a package or other resource type or the title of a published work such as a book or journal)
mod_agreements,erm_resource,erm_agreements_erm_resource,res_type_fk,,ID of reference data value for the type of resource.
mod_agreements,erm_resource,erm_agreements_erm_resource,res_subtype_fk,,ID of reference data value for the subtype of resource
mod_agreements,holdings_coverage,erm_agreements_holdings_coverage,,,
mod_agreements,holdings_coverage,erm_agreements_holdings_coverage,co_id,,UUID for holdings_coverage
mod_agreements,holdings_coverage,erm_agreements_holdings_coverage,co_start_issue,,Earliest issue of the resource linked to the entitlement available as part of this coverage
mod_agreements,holdings_coverage,erm_agreements_holdings_coverage,co_end_issue,,Latest issue of the resource linked to the entitlement available as part of this coverage
mod_agreements,holdings_coverage,erm_agreements_holdings_coverage,co_start_volume,,Earliest volume of the resource linked to the entitlement available as part of this coverage
mod_agreements,holdings_coverage,erm_agreements_holdings_coverage,co_end_volume,,Latest volume of the resource linked to the entitlement available as part of this coverage
mod_agreements,holdings_coverage,erm_agreements_holdings_coverage,co_ent_fk,,The ID of the entitlement to which this holdings_coverage applies
mod_agreements,holdings_coverage,erm_agreements_holdings_coverage,co_start_date,,Earliest date of publication of material from the resource linked to the entitlement available as part of this coverage
mod_agreements,holdings_coverage,erm_agreements_holdings_coverage,co_end_date,,Latest date of publication of material from resourc linked to the entitlemente available as part of this coverage
mod_agreements,identifier,erm_agreements_identifier,,,
mod_agreements,identifier,erm_agreements_identifier,id_id,,UUID of identifier
mod_agreements,identifier,erm_agreements_identifier,id_ns_fk,,ID of identifier namespace
mod_agreements,identifier,erm_agreements_identifier,id_value,,Value of the identifier (i.e. the identifier string)
mod_agreements,identifier_namespace,erm_agreements_identifier_namespace,,,
mod_agreements,identifier_namespace,erm_agreements_identifier_namespace,idns_id,,UUID of identifier_namespace
mod_agreements,identifier_namespace,erm_agreements_identifier_namespace,idns_value,,Value of the namespace (i.e. the namespace name as a string)
mod_agreements,identifier_occurrence,erm_agreements_identifier_occurrence,,,
mod_agreements,identifier_occurrence,erm_agreements_identifier_occurrence,io_id,,UUID of identifier occurrence
mod_agreements,identifier_occurrence,erm_agreements_identifier_occurrence,io_ti_fk,,ID of title_instance which is linked to the identifier
mod_agreements,identifier_occurrence,erm_agreements_identifier_occurrence,io_status,,ID of reference data value (mod_agreements.refdata_value.rdv_id) which describes the status of the identifier occurrence
mod_agreements,identifier_occurrence,erm_agreements_identifier_occurrence,io_identifier_fk,,ID of the identifier which is ‘occurring’ against a title_instance
mod_agreements,order_line,erm_agreements_order_line,,,
mod_agreements,order_line,erm_agreements_order_line,pol_id,,UUID of order_line record
mod_agreements,order_line,erm_agreements_order_line,pol_orders_fk,,ID of purchase order line in Orders app
mod_agreements,order_line,erm_agreements_order_line,pol_owner_fk,,ID of entitlement (mod_agreements.entitlement.ent_id) to which purchase order line is linked
mod_agreements,package,erm_agreements_package,,,
mod_agreements,package,erm_agreements_package,id,,ID of package
mod_agreements,package,erm_agreements_package,pkg_vendor_id,,ID of the package provider organisation (in mod_agreements.orgs)
mod_agreements,package,erm_agreements_package,pkg_source,,String describing the source of the package data
mod_agreements,package,erm_agreements_package,pkg_remote_kb,,ID of the remote knowledgebase from which the package data was obtained (in mod_agreements.remotekb)
mod_agreements,package,erm_agreements_package,pkg_reference,,ID or reference for the package in an external system
mod_agreements,package_content_item,erm_agreements_package_content_item,,,
mod_agreements,package_content_item,erm_agreements_package_content_item,id,,ID of the package content item
mod_agreements,package_content_item,erm_agreements_package_content_item,pci_pti_fk,,ID of the platform_title_instance that the package_content_item is linked to
mod_agreements,package_content_item,erm_agreements_package_content_item,pci_pkg_fk,,ID of the package that the package_content_item belongs to
mod_agreements,package_content_item,erm_agreements_package_content_item,pci_access_start,,The date on which a package_content_item was first accessible in a package
mod_agreements,package_content_item,erm_agreements_package_content_item,pci_access_end,,The date on which a package_content_item was last accessible in a package
mod_agreements,platform,erm_agreements_platform,,,
mod_agreements,platform,erm_agreements_platform,pt_id,,UUID of Platform
mod_agreements,platform,erm_agreements_platform,pt_name,,Name/label of the platform
mod_agreements,platform_title_instance,erm_agreements_platform_title_instance,,,
mod_agreements,platform_title_instance,erm_agreements_platform_title_instance,id,,ID of the platform_title_instance
mod_agreements,platform_title_instance,erm_agreements_platform_title_instance,pti_pt_fk,,The ID of the platform that the platform_title_instance belongs to
mod_agreements,platform_title_instance,erm_agreements_platform_title_instance,pti_ti_fk,,The ID of the title_instance to which the platform_title_instance is linked
mod_agreements,platform_title_instance,erm_agreements_platform_title_instance,pti_url,,The URL of the platform_title_instance
mod_agreements,subscription_agreement,erm_agreements_subscription_agreement,,,
mod_agreements,subscription_agreement,erm_agreements_subscription_agreement,sa_id,,UUID of Agreement
mod_agreements,subscription_agreement,erm_agreements_subscription_agreement,sa_name,,A name for the agreement assigned by the institution
mod_agreements,subscription_agreement,erm_agreements_subscription_agreement,sa_description,,A description for the agreement assigned by the institution
mod_agreements,subscription_agreement,erm_agreements_subscription_agreement,sa_agreement_status,,"ID of reference data value (mod_agreements.refdata_value.rdv_id) which describes the current status of the agreement (e.g. Active, Closed)"
mod_agreements,subscription_agreement,erm_agreements_subscription_agreement,sa_reason_for_closure,,"ID of reference data value (mod_agreements.refdata_value.rdv_id) which describes for a closed agreement, the reason the agreement has been closed (a closed agreement is one with status == ""Closed"" - set via sa_agreement_status)"
mod_agreements,subscription_agreement,erm_agreements_subscription_agreement,sa_renewal_priority,,"ID of reference data value (mod_agreements.refdata_value.rdv_id) which describes whether an agreement should be renewed, reviewed or cancelled"
mod_agreements,subscription_agreement,erm_agreements_subscription_agreement,sa_is_perpetual,,ID of reference data value (mod_agreements.refdata_value.rdv_id) which describes whether the agreement is a perpetual agreement or not
mod_agreements,subscription_agreement,erm_agreements_subscription_agreement,sa_local_reference,,Where an agreement has been created through an integration / data import from an external system the sa_local_reference is used to store a reference/identifier for the agreement in the external system to support ongoing data synchronisation/updates
mod_agreements,subscription_agreement,erm_agreements_subscription_agreement,sa_license_note,,To record any general information about the license for the Agreement
mod_agreements,subscription_agreement,erm_agreements_subscription_agreement,custom_properties_id,,ID used to link custom_properties (aka supplementary properties) via mod_agreements.custom_properties.parent_id to an agreement. (n.b. each agreement can have zero to many custom_properties)
mod_agreements,title_instance,erm_agreements_title_instance,,,
mod_agreements,title_instance,erm_agreements_title_instance,id,,ID of the title_instance
mod_agreements,title_instance,erm_agreements_title_instance,ti_work_fk,,The ID of the work to which the title_instance is linked
mod_agreements,title_instance,erm_agreements_title_instance,ti_date_monograph_published,,"For monographs (books), the date the monograph was first published in the media specified by the linked erm_resource subtype (typically “print” or “electronic”)"
mod_agreements,title_instance,erm_agreements_title_instance,ti_first_author,,"For monographs (books), the last name of the book’s first author."
mod_agreements,title_instance,erm_agreements_title_instance,ti_monograph_edition,,"For monographs (books), the last name of the book’s first author."
mod_agreements,title_instance,erm_agreements_title_instance,ti_monograph_volume,,"For monographs (books), the volume number of the book"
mod_agreements,title_instance,erm_agreements_title_instance,ti_first_editor,,"For monographs (books), the last name of the book’s first editor."
mod_agreements,work,erm_agreements_work,,,
mod_agreements,work,erm_agreements_work,w_id,,UUID of Work
mod_agreements,work,erm_agreements_work,w_title,,Title of the work
mod-audit,/audit-data/circulation/logs,audit_circulation_logs,,,
mod-audit,/audit-data/circulation/logs,audit_circulation_logs,id,string,The UUID format string
mod-audit,/audit-data/circulation/logs,audit_circulation_logs,eventId,string,The UUID format string
mod-audit,/audit-data/circulation/logs,audit_circulation_logs,userBarcode,string,User barcode
mod-audit,/audit-data/circulation/logs,audit_circulation_logs,items,array,Notice items
mod-audit,/audit-data/circulation/logs,audit_circulation_logs,items/itemBarcode,string,Item barcode
mod-audit,/audit-data/circulation/logs,audit_circulation_logs,items/itemId,string,The UUID format string
mod-audit,/audit-data/circulation/logs,audit_circulation_logs,items/instanceId,string,The UUID format string
mod-audit,/audit-data/circulation/logs,audit_circulation_logs,items/holdingId,string,The UUID format string
mod-audit,/audit-data/circulation/logs,audit_circulation_logs,items/loanId,string,The UUID format string
mod-audit,/audit-data/circulation/logs,audit_circulation_logs,object,string,The purchase order line format
mod-audit,/audit-data/circulation/logs,audit_circulation_logs,action,string,The purchase order line format
mod-audit,/audit-data/circulation/logs,audit_circulation_logs,date,string,Event date
mod-audit,/audit-data/circulation/logs,audit_circulation_logs,servicePointId,string,The UUID format string
mod-audit,/audit-data/circulation/logs,audit_circulation_logs,source,string,Source
mod-audit,/audit-data/circulation/logs,audit_circulation_logs,description,string,Description
mod-audit,/audit-data/circulation/logs,audit_circulation_logs,linkToIds,object,Additional data for details
mod-audit,/audit-data/circulation/logs,audit_circulation_logs,linkToIds/userId,string,The UUID format string
mod-audit,/audit-data/circulation/logs,audit_circulation_logs,linkToIds/requestId,string,The UUID format string
mod-audit,/audit-data/circulation/logs,audit_circulation_logs,linkToIds/feeFineId,string,The UUID format string
mod-audit,/audit-data/circulation/logs,audit_circulation_logs,linkToIds/templateId,string,The UUID format string
mod-audit,/audit-data/circulation/logs,audit_circulation_logs,linkToIds/noticePolicyId,string,The UUID format string
mod-audit,/audit-data/acquisition/order,audit_acquisition_order,,,
mod-audit,/audit-data/acquisition/order,audit_acquisition_order,id,string,The UUID format string
mod-audit,/audit-data/acquisition/order,audit_acquisition_order,action,string,The action of the audit event
mod-audit,/audit-data/acquisition/order,audit_acquisition_order,orderId,string,The UUID format string
mod-audit,/audit-data/acquisition/order,audit_acquisition_order,userId,string,The UUID format string
mod-audit,/audit-data/acquisition/order,audit_acquisition_order,eventDate,string,Date time when event triggered
mod-audit,/audit-data/acquisition/order,audit_acquisition_order,actionDate,string,Date time when order action occurred
mod-audit,/audit-data/acquisition/order,audit_acquisition_order,orderSnapshot,object,Full snapshot of the order
mod-audit,/audit-data/acquisition/order-line,audit_acquisition_order_line,,,
mod-audit,/audit-data/acquisition/order-line,audit_acquisition_order_line,id,string,The UUID format string
mod-audit,/audit-data/acquisition/order-line,audit_acquisition_order_line,action,string,The action of the audit event
mod-audit,/audit-data/acquisition/order-line,audit_acquisition_order_line,orderId,string,The UUID format string
mod-audit,/audit-data/acquisition/order-line,audit_acquisition_order_line,orderLineId,string,The UUID format string
mod-audit,/audit-data/acquisition/order-line,audit_acquisition_order_line,userId,string,The UUID format string
mod-audit,/audit-data/acquisition/order-line,audit_acquisition_order_line,eventDate,string,Date time when event triggered
mod-audit,/audit-data/acquisition/order-line,audit_acquisition_order_line,actionDate,string,Date time when order action occurred
mod-audit,/audit-data/acquisition/order-line,audit_acquisition_order_line,orderLineSnapshot,object,Full snapshot of the order line
mod-circulation-storage,/cancellation-reason-storage/cancellation-reasons,circulation_cancellation_reasons,,,
mod-circulation-storage,/cancellation-reason-storage/cancellation-reasons,circulation_cancellation_reasons,id,string,
mod-circulation-storage,/cancellation-reason-storage/cancellation-reasons,circulation_cancellation_reasons,name,string,
mod-circulation-storage,/cancellation-reason-storage/cancellation-reasons,circulation_cancellation_reasons,description,string,
mod-circulation-storage,/cancellation-reason-storage/cancellation-reasons,circulation_cancellation_reasons,publicDescription,string,
mod-circulation-storage,/cancellation-reason-storage/cancellation-reasons,circulation_cancellation_reasons,requiresAdditionalInformation,boolean,
mod-circulation-storage,/cancellation-reason-storage/cancellation-reasons,circulation_cancellation_reasons,source,string,"Origin of the cancellation reason record, e.g. 'System', 'User', 'Consortium' etc."
mod-circulation-storage,/cancellation-reason-storage/cancellation-reasons,circulation_cancellation_reasons,metadata,object,"Metadata about creation and changes to records, provided by the server (client should not provide)"
mod-circulation-storage,/cancellation-reason-storage/cancellation-reasons,circulation_cancellation_reasons,metadata/createdDate,string,Date and time when the record was created
mod-circulation-storage,/cancellation-reason-storage/cancellation-reasons,circulation_cancellation_reasons,metadata/createdByUserId,string,ID of the user who created the record (when available)
mod-circulation-storage,/cancellation-reason-storage/cancellation-reasons,circulation_cancellation_reasons,metadata/createdByUsername,string,Username of the user who created the record (when available)
mod-circulation-storage,/cancellation-reason-storage/cancellation-reasons,circulation_cancellation_reasons,metadata/updatedDate,string,Date and time when the record was last updated
mod-circulation-storage,/cancellation-reason-storage/cancellation-reasons,circulation_cancellation_reasons,metadata/updatedByUserId,string,ID of the user who last updated the record (when available)
mod-circulation-storage,/cancellation-reason-storage/cancellation-reasons,circulation_cancellation_reasons,metadata/updatedByUsername,string,Username of the user who last updated the record (when available)
mod-circulation-storage,/check-in-storage/check-ins,circulation_check_ins,,,
mod-circulation-storage,/check-in-storage/check-ins,circulation_check_ins,id,string,"A universally unique identifier (UUID), this is a 128-bit number used to identify a record and is shown in hex with dashes, for example 6312d172-f0cf-40f6-b27d-9fa8feaf332f; the UUID version must be from 1-5; see https://dev.folio.org/guides/uuids/"
mod-circulation-storage,/check-in-storage/check-ins,circulation_check_ins,occurredDateTime,string,Date and time when the check-in occurred
mod-circulation-storage,/check-in-storage/check-ins,circulation_check_ins,itemId,string,"A universally unique identifier (UUID), this is a 128-bit number used to identify a record and is shown in hex with dashes, for example 6312d172-f0cf-40f6-b27d-9fa8feaf332f; the UUID version must be from 1-5; see https://dev.folio.org/guides/uuids/"
mod-circulation-storage,/check-in-storage/check-ins,circulation_check_ins,itemStatusPriorToCheckIn,string,Item status prior to check-in
mod-circulation-storage,/check-in-storage/check-ins,circulation_check_ins,requestQueueSize,integer,Request queue size for the item
mod-circulation-storage,/check-in-storage/check-ins,circulation_check_ins,itemLocationId,string,"A universally unique identifier (UUID), this is a 128-bit number used to identify a record and is shown in hex with dashes, for example 6312d172-f0cf-40f6-b27d-9fa8feaf332f; the UUID version must be from 1-5; see https://dev.folio.org/guides/uuids/"
mod-circulation-storage,/check-in-storage/check-ins,circulation_check_ins,servicePointId,string,"A universally unique identifier (UUID), this is a 128-bit number used to identify a record and is shown in hex with dashes, for example 6312d172-f0cf-40f6-b27d-9fa8feaf332f; the UUID version must be from 1-5; see https://dev.folio.org/guides/uuids/"
mod-circulation-storage,/check-in-storage/check-ins,circulation_check_ins,performedByUserId,string,"A universally unique identifier (UUID), this is a 128-bit number used to identify a record and is shown in hex with dashes, for example 6312d172-f0cf-40f6-b27d-9fa8feaf332f; the UUID version must be from 1-5; see https://dev.folio.org/guides/uuids/"
mod-circulation-storage,/fixed-due-date-schedule-storage/fixed-due-date-schedules,circulation_fixed_due_date_schedules,,,
mod-circulation-storage,/fixed-due-date-schedule-storage/fixed-due-date-schedules,circulation_fixed_due_date_schedules,id,string,Unique ID (generated UUID)
mod-circulation-storage,/fixed-due-date-schedule-storage/fixed-due-date-schedules,circulation_fixed_due_date_schedules,name,string,
mod-circulation-storage,/fixed-due-date-schedule-storage/fixed-due-date-schedules,circulation_fixed_due_date_schedules,description,string,
mod-circulation-storage,/fixed-due-date-schedule-storage/fixed-due-date-schedules,circulation_fixed_due_date_schedules,schedules,array,
mod-circulation-storage,/fixed-due-date-schedule-storage/fixed-due-date-schedules,circulation_fixed_due_date_schedules,metadata,object,"Metadata about creation and changes to records, provided by the server (client should not provide)"
mod-circulation-storage,/fixed-due-date-schedule-storage/fixed-due-date-schedules,circulation_fixed_due_date_schedules,metadata/createdDate,string,Date and time when the record was created
mod-circulation-storage,/fixed-due-date-schedule-storage/fixed-due-date-schedules,circulation_fixed_due_date_schedules,metadata/createdByUserId,string,ID of the user who created the record (when available)
mod-circulation-storage,/fixed-due-date-schedule-storage/fixed-due-date-schedules,circulation_fixed_due_date_schedules,metadata/createdByUsername,string,Username of the user who created the record (when available)
mod-circulation-storage,/fixed-due-date-schedule-storage/fixed-due-date-schedules,circulation_fixed_due_date_schedules,metadata/updatedDate,string,Date and time when the record was last updated
mod-circulation-storage,/fixed-due-date-schedule-storage/fixed-due-date-schedules,circulation_fixed_due_date_schedules,metadata/updatedByUserId,string,ID of the user who last updated the record (when available)
mod-circulation-storage,/fixed-due-date-schedule-storage/fixed-due-date-schedules,circulation_fixed_due_date_schedules,metadata/updatedByUsername,string,Username of the user who last updated the record (when available)
mod-circulation-storage,/loan-storage/loan-history,circulation_loan_history,,,
mod-circulation-storage,/loan-storage/loan-history,circulation_loan_history,id,string,Unique ID (generated UUID) of the snapshot of the loan record
mod-circulation-storage,/loan-storage/loan-history,circulation_loan_history,operation,string,"Type of change that triggered this loan record snapshot: I for insert, U for update, D for delete"
mod-circulation-storage,/loan-storage/loan-history,circulation_loan_history,creationDate,string,When this snapshot was created
mod-circulation-storage,/loan-storage/loan-history,circulation_loan_history,loan,object,Links the item with the patron and applies certain conditions based on policies
mod-circulation-storage,/loan-storage/loan-history,circulation_loan_history,loan/id,string,Unique ID (generated UUID) of the loan
mod-circulation-storage,/loan-storage/loan-history,circulation_loan_history,loan/userId,string,"ID of the patron the item was lent to. Required for open loans, not required for closed loans (for anonymization)."
mod-circulation-storage,/loan-storage/loan-history,circulation_loan_history,loan/proxyUserId,string,ID of the user representing a proxy for the patron
mod-circulation-storage,/loan-storage/loan-history,circulation_loan_history,loan/itemId,string,ID of the item lent to the patron
mod-circulation-storage,/loan-storage/loan-history,circulation_loan_history,loan/itemEffectiveLocationIdAtCheckOut,string,"A universally unique identifier (UUID), this is a 128-bit number used to identify a record and is shown in hex with dashes, for example 6312d172-f0cf-40f6-b27d-9fa8feaf332f; the UUID version must be from 1-5; see https://dev.folio.org/guides/uuids/"
mod-circulation-storage,/loan-storage/loan-history,circulation_loan_history,loan/status,object,Overall status of the loan
mod-circulation-storage,/loan-storage/loan-history,circulation_loan_history,loan/status/name,string,"Name of the status (currently can be any value, values commonly used are Open and Closed)"
mod-circulation-storage,/loan-storage/loan-history,circulation_loan_history,loan/loanDate,string,Date time when the loan began (typically represented according to rfc3339 section-5.6. Has not had the date-time format validation applied as was not supported at point of introduction and would now be a breaking change)
mod-circulation-storage,/loan-storage/loan-history,circulation_loan_history,loan/dueDate,string,Date time when the item is due to be returned
